{
  "commandType": "DefineRule",
  "workspaceId": "11111111-1111-4111-8111-111111111111",
  "correlationId": "22222222-2222-4222-8222-222222222222",
  "idempotencyKey": "define-rule-budget-positive-1",
  "payload": {
    "ruleCode": "budget_positive",
    "scope": { "objectTypeCode": "requirement", "fieldCode": "budget" },
    "severity": "BLOCK",
    "when": "field('budget') < 0",
    "message": "预算不能为负:${field('budget')}",
    "suggest": "填写非负预算",
    "lightweight": true
  }
}
